title,date
"सुनको भाउ लगातार तेश्रो दिन घट्यो, चाँदी भने बढ्यो","Nov 25, 2021 11:23 AM"
स्पेशल प्रि ओपन सेसनमा न्यादीको शेयर कारोबार भएन,"Nov 25, 2021 10:54 AM"
प्रि ओपन सेसन अपडेटः करिब २ अंक बढ्यो नेप्से,"Nov 25, 2021 10:51 AM"
स्पेशल प्रि ओपनमा सामलिङ्ग पावरको कतिमा भयो शेयर कारोबार?,"Nov 25, 2021 10:47 AM"
साना किसान विकास लघुवित्तले घोषणा गर्यो लाभांश,"Nov 25, 2021 10:36 AM"
कालिका लघुवित्तको बाेनस घोषणा,"Nov 25, 2021 10:36 AM"
ज्योति विकास बैंकको लाभांश घोषणा,"Nov 25, 2021 10:31 AM"
लाभांश प्रस्ताव पारित गर्न एभरेष्ट बैंकले डाक्यो साधारण सभा,"Nov 25, 2021 09:10 AM"
title,date
"बिहीबार देशभरमा ३०८ जना कोरोना संक्रमित थपिए,  तीन जनाको निधन","Nov 25, 2021 05:29 PM"
"विद्युत ग्रीड आधुनिकीकरण परियोजनाका लागि एडिबिले दिने भयो थप सात अर्ब ऋण,सम्झौता शुक्रबार हुने","Nov 25, 2021 04:51 PM"
‘पर्ख र हेर’ को अवस्थामा लगानीकर्ता,"Nov 25, 2021 03:24 PM"
राष्ट्रिय सुरक्षाको कारण देखाउँदै दर्जनभन्दा बढी चिनियाँ कम्पनीहरु युएसकाे ब्ल्याकलिस्टमा,"Nov 25, 2021 02:18 PM"
नेपाललाई अल्पविकसित देशबाट स्तरोन्नति गर्ने प्रस्ताव राष्ट्रसङ्घद्वारा अनुमोदन,"Nov 25, 2021 01:06 PM"
तरलता सहज बनाउन वित्तीय बजारमा २० अर्ब पठाउदै राष्ट्र बैंक,"Nov 25, 2021 12:29 PM"
"सुनको भाउ लगातार तेश्रो दिन घट्यो, चाँदी भने बढ्यो","Nov 25, 2021 11:23 AM"
स्पेशल प्रि ओपन सेसनमा न्यादीको शेयर कारोबार भएन,"Nov 25, 2021 10:54 AM"
